{
  "schema_version": "1.0.0-draft",
  "status": "NONCANONICAL_PROGRAMME_CONTROL",
  "universes": [
    {
      "universe_id": "SU-ECOSYSTEM",
      "name": "NeuroAI organizations and exact systems",
      "purpose": "Discover and maintain source-backed identities for organizations, programmes, products and exact systems relevant to NeuroAI.",
      "unit": "source-supported organization or system identity",
      "inclusion_criteria": ["Public evidence supports a NeuroAI-relevant organization, programme, product or exact system identity."],
      "exclusion_criteria": ["Name-only candidates without sufficient identity evidence.", "Author collectives represented more accurately as provenance nodes."],
      "preferred_source_classes": ["OFFICIAL_ORGANIZATION", "OFFICIAL_PRODUCT_OR_TECHNOLOGY", "OFFICIAL_INSTITUTIONAL"],
      "secondary_source_classes": ["REPUTABLE_SECONDARY_CORROBORATION"],
      "languages": ["English", "Additional languages through governed regional expansion"],
      "jurisdictions": [],
      "retrieval_strategy": "Controlled official-surface discovery plus explicit entity-resolution proposals and source-backed regional expansion.",
      "refresh_policy": "Risk-based recurring monitoring for living organization/product surfaces; archival handling for fixed historical records.",
      "coverage_methodology": "Declare frozen discovery strata or query programmes and report denominators/limitations; do not infer global completeness from record count.",
      "known_blind_spots": ["Organizations without accessible official web presence.", "Non-English ecosystems outside implemented language coverage.", "Private or stealth programmes."],
      "implementation_state": "CURRENT_BOUNDED",
      "canonical_completeness_claim": false
    },
    {
      "universe_id": "SU-PUBLICATIONS",
      "name": "Scientific publications and preprints",
      "purpose": "Identify primary scientific evidence, technical reports, preprints and publication corrections relevant to represented systems, models and datasets.",
      "unit": "publication or preprint record",
      "inclusion_criteria": ["Publication materially supports a represented NeuroAI system, model, dataset, benchmark, clinical study or assessment question."],
      "exclusion_criteria": ["Pure commentary without evidentiary relevance unless retained as explicitly secondary context."],
      "preferred_source_classes": ["PEER_REVIEWED_PRIMARY_PUBLICATION", "PREPRINT", "OFFICIAL_BIBLIOGRAPHIC_METADATA"],
      "secondary_source_classes": ["REVIEW_PUBLICATION"],
      "languages": ["English"],
      "jurisdictions": [],
      "retrieval_strategy": "Structured bibliographic discovery supplemented by exact DOI/title/author reconciliation and bounded repository searches.",
      "refresh_policy": "Recurring discovery for new publications; fixed articles become archival while corrections/retractions remain monitored through source-specific mechanisms.",
      "coverage_methodology": "Track declared query streams, indexing sources, search windows, deduplication, and sampled missed-result review.",
      "known_blind_spots": ["Unindexed publications.", "Publication metadata without accessible full text.", "Non-English and regional indexes not yet integrated."],
      "implementation_state": "PARTIAL",
      "canonical_completeness_claim": false
    },
    {
      "universe_id": "SU-TRIALS",
      "name": "Clinical studies and trial registries",
      "purpose": "Maintain explicit study, trial, status, endpoint and site evidence for NeuroAI systems with clinical research activity.",
      "unit": "trial or study registry record",
      "inclusion_criteria": ["Registry or primary study evidence identifies a NeuroAI-relevant intervention, system or exact assessment dependency."],
      "exclusion_criteria": ["Trial-site relationships inferred only from institutional existence."],
      "preferred_source_classes": ["OFFICIAL_TRIAL_REGISTRY", "OFFICIAL_STUDY_RECORD"],
      "secondary_source_classes": ["PEER_REVIEWED_PRIMARY_CLINICAL_STUDY", "OFFICIAL_DEVELOPER_TRIAL_ANNOUNCEMENT"],
      "languages": ["English"],
      "jurisdictions": [],
      "retrieval_strategy": "Structured registry retrieval keyed by controlled identifiers and bounded successor discovery across official registries.",
      "refresh_policy": "Recurring monitoring while recruitment, follow-up, status or results posting can change.",
      "coverage_methodology": "Report registry scope, query/identifier strategy, monitored-record denominator, and unresolved cross-registry matches.",
      "known_blind_spots": ["Unregistered studies.", "Registries without stable public structured access.", "Cross-registry duplicate and sponsor-name ambiguity."],
      "implementation_state": "PARTIAL",
      "canonical_completeness_claim": false
    },
    {
      "universe_id": "SU-MODELS",
      "name": "NeuroAI models and checkpoints",
      "purpose": "Represent model families, released checkpoints, announced roadmaps, training/evaluation claims and model lineage without conflating them.",
      "unit": "model family, checkpoint or model-release record",
      "inclusion_criteria": ["Primary or controlled scientific evidence establishes a NeuroAI-relevant model, checkpoint or roadmap identity."],
      "exclusion_criteria": ["Treating a roadmap announcement as evidence that a checkpoint exists.", "Treating a paper title as a unique model identity without resolution."],
      "preferred_source_classes": ["PRIMARY_MODEL_PUBLICATION", "OFFICIAL_MODEL_REPOSITORY", "OFFICIAL_DEVELOPER_MODEL_RELEASE"],
      "secondary_source_classes": ["MODEL_BENCHMARK_OR_AUDIT", "OFFICIAL_MODEL_ROADMAP_ANNOUNCEMENT"],
      "languages": ["English"],
      "jurisdictions": [],
      "retrieval_strategy": "Publication/repository discovery with persistent-identifier and developer/author entity resolution.",
      "refresh_policy": "Recurring discovery for new releases/checkpoints; archival preservation of fixed model publications and releases.",
      "coverage_methodology": "Track declared repositories/reviews/query streams and distinguish enumerated review universes from the global model universe.",
      "known_blind_spots": ["Private checkpoints.", "Unreleased industrial models.", "Incomplete training-data and licensing disclosures."],
      "implementation_state": "PARTIAL",
      "canonical_completeness_claim": false
    },
    {
      "universe_id": "SU-DATASETS",
      "name": "Neuroscience datasets and benchmarks",
      "purpose": "Identify datasets, benchmark universes and dataset/model lineage relevant to NeuroAI evaluation and training claims.",
      "unit": "dataset, benchmark or registry object",
      "inclusion_criteria": ["A dataset or benchmark is explicitly relevant to a represented model/system or to a governed source-universe programme."],
      "exclusion_criteria": ["Automatically expanding registry-level aggregate counts into individual canonical dataset entities without identity evidence."],
      "preferred_source_classes": ["OFFICIAL_DATASET_REPOSITORY", "PRIMARY_DATASET_PUBLICATION", "BENCHMARK_REPOSITORY"],
      "secondary_source_classes": ["DATASET_REGISTRY", "MODEL_BENCHMARK_PUBLICATION"],
      "languages": ["English"],
      "jurisdictions": [],
      "retrieval_strategy": "Controlled registry/repository enumeration plus explicit dataset identity and model-lineage reconciliation.",
      "refresh_policy": "Release-aware discovery and periodic registry refresh.",
      "coverage_methodology": "Preserve registry-reported denominators and limitations; separately report individually resolved canonical datasets.",
      "known_blind_spots": ["Private datasets.", "Unclear consent/secondary-use metadata.", "Dataset version and derivative ambiguity."],
      "implementation_state": "PARTIAL",
      "canonical_completeness_claim": false
    },
    {
      "universe_id": "SU-REGULATION",
      "name": "Regulatory, legal and post-market evidence",
      "purpose": "Track exact jurisdiction- and configuration-scoped regulatory states and relevant post-market actions.",
      "unit": "regulatory/legal/post-market record or event",
      "inclusion_criteria": ["Official regulator or legal source materially bears on a represented system, device, indication, configuration or assessment dependency."],
      "exclusion_criteria": ["Inferring authorization from company marketing language where an applicable official record is required."],
      "preferred_source_classes": ["OFFICIAL_REGULATORY_RECORD", "OFFICIAL_LEGAL_TEXT", "OFFICIAL_RECALL_OR_POSTMARKET_RECORD"],
      "secondary_source_classes": ["OFFICIAL_COMPANY_REGULATORY_ANNOUNCEMENT", "REPUTABLE_SECONDARY_CORROBORATION"],
      "languages": ["English", "Jurisdiction-specific official languages as implemented"],
      "jurisdictions": [],
      "retrieval_strategy": "Official regulator/legal sources prioritized, with structured adapters where available and explicit source-route resilience.",
      "refresh_policy": "High-priority recurring monitoring for living regulatory records and relevant post-market sources; on-change monitoring for legal/normative text.",
      "coverage_methodology": "Report jurisdictions and regulator surfaces actually implemented; never generalize one jurisdictional state globally.",
      "known_blind_spots": ["Non-public submissions/dossiers.", "Regulatory databases without stable public access.", "Jurisdictions not yet implemented."],
      "implementation_state": "PARTIAL",
      "canonical_completeness_claim": false
    },
    {
      "universe_id": "SU-GRANTS",
      "name": "Public research funding and grants",
      "purpose": "Represent source-backed public funding events and programme support relevant to NeuroAI entities and research infrastructure.",
      "unit": "grant or public award record",
      "inclusion_criteria": ["Official funding data identifies a relevant award, recipient and programme relationship."],